id_review,caption,relative_date,retrieval_date,rating,username,n_review_user,n_photo_user,url_user
ChZDSUhNMG9nS0VJQ0FnSURtazlpSEl3EAE,"A wonderful experience and peak into the rich history of Coca Cola! You are also able to taste a variety of Coca Cola products from around the world. You can buy advance tickets online which makes it a bit easier to get in. Luckily when we went there was not much of a line, however the online experience is pretty seamless as well!",a year ago,2023-02-14 16:49:28.140502,5.0,Mia T,0,0,https://www.google.com/maps/contrib/114171092840325382326/reviews?hl=en-US
ChZDSUhNMG9nS0VJQ0FnSUQ2X2JyM0N3EAE,"Very interesting and fun for all ages. The staff was spectacular,  full of friendly smiles and helpful energy. Can't wait to go back again. So much to learn, and I'm sure I didn't get it all.  Halloween 🎃 exhibit was very cute!",a year ago,2023-02-14 16:49:28.141762,5.0,Katherine McConnell,0,0,https://www.google.com/maps/contrib/108996444270138464555/reviews?hl=en-US
ChZDSUhNMG9nS0VJQ0FnSUM2dDZmWVh3EAE,"If your idea of fun is getting to try coke products that you’ve never heard of from around the world, this is the place for you.  Across a shared garden with the Georgia Aquarium and the Center for Civil and Human Rights, the World of Coca-Cola presents a fun history of the world's best secret recipe (which is kept in a vault at the museum). Interactive displays, scent challenge, taste testing, nice souvenir shop and enthusiastic hosts.  The World of Coca-Cola on Baker Street in Atlanta is a cool place to visit and learn about all things Coca-Cola. I really like all of the history and different items that they have on display here. The museum has a nice design and architecture. The staff here is very friendly and knowledgeable. My favorite part is being able to sample the different types of cokes from around the world. This place is fun and worth checking out.",a year ago,2023-02-14 16:49:28.143016,5.0,anirudh girey,0,0,https://www.google.com/maps/contrib/107819193122042224125/reviews?hl=en-US
ChZDSUhNMG9nS0VJQ0FnSUNCaDVuNEFREAE,"Lots of fun and interactive exhibits- my favorite being the tasting room. There is also a smelling room, a movie theater, a history display, and more. It is a popular place, therefore a lot of my time was spent waiting outside of the exhibits, and the tasting room was not well regulated for crowds. Regardless, the staff were very nice and helped in the ways they could.",a month ago,2023-02-14 16:49:28.144232,4.0,Alex Lichty,0,0,https://www.google.com/maps/contrib/114985147969658779070/reviews?hl=en-US
ChdDSUhNMG9nS0VJQ0FnSUM2bGVQdTV3RRAB,Had a really good time at the world of coca cola.  The history behind the drink is intriguing and the building is fun.  Love the artifacts and the tasting room and the movie theater along with the 3d film was quite enjoyable.  Beware your belly will be filled with coke products in the end.,a year ago,2023-02-14 16:49:28.145276,5.0,Katina Payne,0,0,https://www.google.com/maps/contrib/110675719307454226249/reviews?hl=en-US
ChZDSUhNMG9nS0VJQ0FnSUQtc3NmQlBnEAE,"One of the most touristy things to do in atlanta is to visit the world of cococola, that doesn't mean it's bad ,it's just over hyped and crowded. You got to try over 100 plus varieties of cococola drinks from around the world and learn about the history of cococola.",2 months ago,2023-02-14 16:49:28.146395,5.0,gowtham Y.R,0,0,https://www.google.com/maps/contrib/112647521750802786868/reviews?hl=en-US
ChZDSUhNMG9nS0VJQ0FnSUQtNUpXTkd3EAE,Amazing experience! I would definitely swing by again many times as I can. Even if it’s not a cheap entertainment place. Love it !,2 months ago,2023-02-14 16:49:37.036998,5.0,Algarte,0,0,https://www.google.com/maps/contrib/104450037704473337111/reviews?hl=en-US
ChdDSUhNMG9nS0VJQ0FnSUNCdnNXQnVRRRAB,Fun to visit this place ! Good and nice experience of visiting this place to know the history of the fest drink !! Just 1-2 hours is enough ! Plan this visit with the aquarium ! Kids friendly place !,a month ago,2023-02-14 16:49:37.039951,5.0,Ashok R,0,0,https://www.google.com/maps/contrib/115422425540091050568/reviews?hl=en-US
ChZDSUhNMG9nS0VJQ0FnSUQtLTQtV1d3EAE,Great time and great guides as well. They had a taste center for different soda around the world. And a smell room and all the history you could want about the company.,2 months ago,2023-02-14 16:49:37.042725,5.0,Natalie,0,0,https://www.google.com/maps/contrib/116077733704942266238/reviews?hl=en-US
ChZDSUhNMG9nS0VJQ0FnSUQtNzhfRGN3EAE,Place was fun way to spend an afternoon. Entrance was 20 dolars and the best part is for sure the beverage testing in the end.,2 months ago,2023-02-14 16:49:37.045371,5.0,Viktor,0,0,https://www.google.com/maps/contrib/111077786231815276851/reviews?hl=en-US
ChdDSUhNMG9nS0VJQ0FnSUMtZ3FuaWtBRRAB,Took a look around the place and really enjoy the history of coke and seeing the vault and the scent room.  However was kind of sad when I found out I could not buy the different kind of coke that I just sample and bring some home.  Would of like to brought some home to my parents who no longer travel that much.  Also seen like they were a little pricey on the souvenir items.,3 months ago,2023-02-14 16:49:37.048154,3.0,Jason Armstrong,0,0,https://www.google.com/maps/contrib/109873717546154440477/reviews?hl=en-US
ChdDSUhNMG9nS0VJQ0FnSUQtMWVlXzZRRRAB,"Writing by @Driven_Estates: Where have I been? Well today I decided to take my family to the world of coca-cola! @worldofcocacola Our experience was absolutely amazing! The most rememberable moments was the Smell test, and taste test! If you plan on moving to or visiting Atlanta Georgia, you absolutely have to visit the World Of Coca-Cola. It's best if you purchase your tickets online. The Parking Garage Address is: 126 Ivan Allen Jr. Blvd NW Atlanta, GA 30313. Definitely a five star attraction ⭐⭐⭐⭐⭐",2 months ago,2023-02-14 16:49:37.050813,5.0,Tavin Washington,0,0,https://www.google.com/maps/contrib/104260881490374856668/reviews?hl=en-US
ChdDSUhNMG9nS0VJQ0FnSUNhOWVfZXBnRRAB,"Upon entering I received a can of Coca Cola of my choice. After that, I entered a room where a movie played and I was greeted by an employee who was extremely kind and funny. We were guided through and area where the “secret recipe” is supposedly stored. After this, we watched a 3D movie about Coca Cola which was truly interesting. One of my favourite parts was the tasting room. This room had many of the different beverages that Coca Cola make from all over the world. Another interesting part of the museum was the history room. This room had many items and videos about the history of Coca Cola. After we visited the room that showed how it is is produced, we left through the gift shop which had many interesting gifts. Overall a great experience for only 14 dollars!",a year ago,2023-02-14 16:49:37.053468,5.0,Bijan Markazi,0,0,https://www.google.com/maps/contrib/103562696509523722845/reviews?hl=en-US
ChZDSUhNMG9nS0VJQ0FnSUNCeExHUFNREAE,"Not enough Diet Coke stories or testers or merch. Why are they trying to cover up Diet Coke’s existence when it’s their greatest product? When it’s the world’s greatest product?  The tasting room is fun, despite the lack of Diet Cokes from around the world. (Even Coke Light should be featured, but don’t get me started on that garbage Coke Zero nonsense.)",a month ago,2023-02-14 16:49:37.055902,3.0,Katie P,0,0,https://www.google.com/maps/contrib/111393773479387851327/reviews?hl=en-US
ChdDSUhNMG9nS0VJQ0FnSURCc3BUXzhRRRAB,Just a wonderful experience overall.   So much history if you take your time and watch/read everything.  The tasting room is great.  Always fun things to try in there.  The international flavors are all... Interesting.,4 weeks ago,2023-02-14 16:49:37.058067,5.0,Michael M,0,0,https://www.google.com/maps/contrib/107442597008015016108/reviews?hl=en-US
ChZDSUhNMG9nS0VJQ0FnSUNld2JfS1dnEAE,"Worth visiting. The theme is the secret of the Coca Cola receipt, which is very well exhibited. Disappointed about the Taste it! Part which should be a highlight. There are only three different kind of stations each with 8 flavors, and the 100+ flavors is provided by the machine that you can easily find at fast food restaurant.",4 months ago,2023-02-14 16:49:37.060272,4.0,Chao Peng,0,0,https://www.google.com/maps/contrib/101748730479135001460/reviews?hl=en-US
