id_review,caption,relative_date,retrieval_date,rating,username,n_review_user,n_photo_user,url_user
ChdDSUhNMG9nS0VJQ0FnSURHbnFDUzFBRRAB,"A historic place. One of the iconic place,  landmarks of Atlanta. Located right in the most happening part of Downtown Atlanta. There is an entry ticket of around $19 per adult. One has to select a particular time slot. Entry is allowed in batches as there are guided assigned who will take over. There is a 3-D theatre here, a pop culture gallary, plenty of photography spots, Scent discovery outlet,  a coca cola merchandise store  and clean washrooms. The highlight of this place is the Taste it tasting room where one can try all the different types of coca cola beverages available in all the countries across the world. You can have as much as you want. All in all, it was an amazing experience. One must not miss visiting this place at any cost. Would surely recommend.",a year ago,2023-02-14 16:48:46.589415,5.0,Suxant,0,0,https://www.google.com/maps/contrib/101822038523524271496/reviews?hl=en-US
ChdDSUhNMG9nS0VJQ0FnSUMteTVLcm1BRRAB,"The birth of the world famous coca cola.!! My favorite was the tasting room . Experiencing the different flavors of coca cola from all around the world was truly a great experience.  Also enjoyed the smell room where we experienced the fruity spicy and honey flavors used in coca cola.  Taking a picture with the polar bear is a must as well!!  The other exhibits like the vault , bottle making machines are decent as well. Definitely a one time visit if you visit Atlanta",3 months ago,2023-02-14 16:48:54.524447,5.0,Gaurav Hegde,0,0,https://www.google.com/maps/contrib/110421453916580205070/reviews?hl=en-US
ChdDSUhNMG9nS0VJQ0FnSURta0l1VGl3RRAB,One of the must place to visit in Atlanta. It was an Amazing experience. The place is so clean and well maintained. They have many artifacts on display that shows evolution of coca cola. This place also has many photographic opportunities. The 3D show here is one of the best we have seen. It was spectacular. Finally sampling area that gives opportunity to taste various coca cola products from all over the world. Entry pass is available only thru online. Place worth a visit. The souvenir shop has many products at affordable rates. This place is just 10 minutes walk from Peachtree Marta station.,a year ago,2023-02-14 16:48:54.526100,5.0,Travel_Photography,0,0,https://www.google.com/maps/contrib/109691248403626514867/reviews?hl=en-US
ChRDSUhNMG9nS0VJQ0FnSUNtN1BBbBAB,"I had so much fun stopping here! I enjoyed getting to learn about the history of Coca Cola and my favorite part was getting to try all the different Coca Cola products available worldwide at the end. It was fun to try the different flavors in China, Russia, Germany, Thailand,, etc all while in the same place. The gift shop was nice too!",a year ago,2023-02-14 16:48:54.527648,4.0,Sandra Lynsdale,0,0,https://www.google.com/maps/contrib/106448901222944209737/reviews?hl=en-US
ChZDSUhNMG9nS0VJQ0FnSURleHI3WFBnEAE,"This is a good place for adults or kids that can read. If you have small kids there isn't anything for them here.  If you are going in the afternoon make sure you go to the second floor as soon as you can to take the photo with the polar bear. When we entered no one from the staff told us that the polar bear was only available for pictures until 4:30pm. That was a disappointment.  Check the photos here in Google maps before you go. If you don't find the pictures interesting, then it is very likely you won't like inside even if you are a major fan of Coca-Cola and drink it every day.",4 months ago,2023-02-14 16:48:54.529125,4.0,Vini Miranda,0,0,https://www.google.com/maps/contrib/116281836913010299109/reviews?hl=en-US
ChZDSUhNMG9nS0VJQ0FnSURtdjdxWWVnEAE,"I enjoyed the experience here. Loved learning about the history of Coca Cola, the company’s evolution, and the different drinks they make. Tasting the different drinks from around the world was my favorite part. I recommend this experience to anyone interested in branding, marketing, and business in general. Inspiring business story in my opinion.",a year ago,2023-02-14 16:48:54.530742,5.0,Nora the Food Explora,0,0,https://www.google.com/maps/contrib/110474658059819583162/reviews?hl=en-US
ChZDSUhNMG9nS0VJQ0FnSURHd056TmNnEAE,"Our visit was 16 Sep 2021 in the afternoon, there was three of us.  We really enjoyed the history and this museum.  We enjoyed the taste testing, nose testing and all the beautiful experiences Coca Cola offered.  We all brought items from the store.  My sister and I are huge Coke fans, hey I’m from Philly.  We are always having a Coke and a smile.  Place was very clean and kept up.  The staff was very professional and pleasant.  I hope to get some of my family members down and the ones that lived in GA have not been yet.  I would like to make it one day down during the holidays with all the lights.  There are plenty of parking garages or lots.  The aquarium is right across from Coke.  This was the last day of our business trip before flying and I will be back.",a year ago,2023-02-14 16:48:54.537527,5.0,Philly Red,0,0,https://www.google.com/maps/contrib/101233779088139365187/reviews?hl=en-US
ChZDSUhNMG9nS0VJQ0FnSUNXaUtMcFF3EAE,"Visited here on a whim and with very low expectations, but was pleasantly surprised by how much effort was put into all the exhibits. This history of Coca-Cola was really interesting to follow and seeing old memorabilia was pretty cool. Our favorite part of the experience was trying all the soda samples from different parts of the world. It was pretty cool to taste the differences in flavor vs location! One small warning, beware of Beverly from Italy 😅",11 months ago,2023-02-14 16:48:54.538837,5.0,John Velasco,0,0,https://www.google.com/maps/contrib/105200565366006063190/reviews?hl=en-US
ChZDSUhNMG9nS0VJQ0FnSUQtNXF2OUd3EAE,Parking is available within a 10 minutes walk..! Tickets can buy at the counter also. It took 40-50 minutes to explore inside. We tasted more than 50 plus flavors. Definitely one of the best place to visit once.,2 months ago,2023-02-14 16:48:54.540451,5.0,Kesava Nidadavolu,0,0,https://www.google.com/maps/contrib/111771329957604632416/reviews?hl=en-US
ChZDSUhNMG9nS0VJQ0FnSUNlbWNYblRREAE,"I don’t really drink coca cola, but I LOVE this museum. It’s so well designed and gives you an unforgettable experience.  You get to smell different ingredients in different coca cola products and taste all the different flavours around the world.  Totally enjoyed my tour and recommend anyone to go if you get a chance.",4 months ago,2023-02-14 16:48:54.541883,5.0,Jing Wu,0,0,https://www.google.com/maps/contrib/107749535299189984492/reviews?hl=en-US
ChZDSUhNMG9nS0VJQ0FnSUMtaGZpaFJBEAE,I loved exploring the history of Coca Cola. The workers are so cheerful and make the tour interesting. My favorite part was the taste it. Some of the coca colas were unbearable (I.e Uganda and Beverly) but some of them were really good.,3 months ago,2023-02-14 16:48:54.551140,5.0,Briyah Brown,0,0,https://www.google.com/maps/contrib/117725115055463637459/reviews?hl=en-US
ChZDSUhNMG9nS0VJQ0FnSURCeVpLOVhREAE,This is my second time visiting. My first time was when I was in middle school. I took my little sister and cousin and enjoyed it just the same as an adult.  The scent room wasn’t open but will open back up in March. The staff are very friendly and express the spirit of coca-cola. The door ambassador that started the journey kept us engaged and excited about our experience.  There was a lot of people there as it was MLK weekend when we took our visit. The taste it room is fun. The videos are full of adventure and does a good job at drawing you in to the experience. It was nice to get refreshed on the experience of coca-cola. I highly recommend experiencing this place and the Georgia Aquarium on the same day. They are located right beside each other.  Make sure you are thirty when you go so that you can taste as many flavors as possible of coca-cola products. There is a lot of history to learn during this tour and experience. You can buy your tickets there. We didn’t wait it line long to purchase tickets.,3 weeks ago,2023-02-14 16:49:02.861991,5.0,Delvakio Brown,0,0,https://www.google.com/maps/contrib/103927722284200608657/reviews?hl=en-US
ChdDSUhNMG9nS0VJQ0FnSUMtOGV1cGdnRRAB,"I mean, it's everything you'd expect from the Coca Cola museum. The movie was pretty cool, and then the sensory experience were definitely most worth it. The other rooms were also fun, where they explain the history and some of the ways with which it influenced pop culture. So much sugar though at the end!",3 months ago,2023-02-14 16:49:02.865171,5.0,Claudio Lener,0,0,https://www.google.com/maps/contrib/100753196098664736488/reviews?hl=en-US
ChdDSUhNMG9nS0VJQ0FnSUNCMlpfanFBRRAB,"Absolutely amazing experience! I loved every second of it. For those in the know, im so happy I got to try Beverly. Now don't get me wrong, it was bad, but not nearly as bad as I thought considering it's considered the worst drink in the world. Lol.  That being said, the entire time I was there I had a smile on my face and it's so cool to see and learn about the history of Coca-Cola. Would totally recommend it!",a month ago,2023-02-14 16:49:02.867287,5.0,Krozmic,0,0,https://www.google.com/maps/contrib/104416921402174013255/reviews?hl=en-US
ChZDSUhNMG9nS0VJQ0FnSUNlck9hakV3EAE,"Super fun place specially with kids. Taste colas from around the world - about 100 flavors. Learn all about the art and science of cola making and the history of Coca cola, the drink that changed the beverage industry!",5 months ago,2023-02-14 16:49:02.868890,4.0,Sowmya Mahesh,0,0,https://www.google.com/maps/contrib/110737048551302629407/reviews?hl=en-US
ChdDSUhNMG9nS0VJQ0FnSUQtdzRfYTRnRRAB,Had a real fun time there. The best part was we got to try over 40 different drinks from all over the world. It's definitely worth visiting.,2 months ago,2023-02-14 16:49:02.870307,5.0,Sunita Pathak,0,0,https://www.google.com/maps/contrib/102087837702139217785/reviews?hl=en-US
ChZDSUhNMG9nS0VJQ0FnSUNtanNQbUxREAE,"This is a good tour for a soda enthusiast or someone with an interest in old coca-cola memorabilia. They cram as many people as possible into each tour. This makes for navigating the area and information painful. You are able to view at your own pace, but it's too crowded.  Tasting about 30 sodas was fun, though.",a year ago,2023-02-14 16:49:02.872146,3.0,Nelson Weems,0,0,https://www.google.com/maps/contrib/113687551009237525252/reviews?hl=en-US
ChZDSUhNMG9nS0VJQ0FnSURleHNuYlBnEAE,Did a private tour with Kristin today. Loved it!! Our  group of 7 plus 5 other people. Kristin was so cheerful and funny. From start to finish it was an entertaining experience. Definitely worth the extra money to pay for the private experience.,4 months ago,2023-02-14 16:49:02.873460,5.0,CharlesandDionisha Johnson,0,0,https://www.google.com/maps/contrib/100992706639828105679/reviews?hl=en-US
ChdDSUhNMG9nS0VJQ0FnSURtNllLTDRBRRAB,"We visited the World of Coca-Cola pre-covid. It was quite the experience. I would say there is something for everybody there. My favorite thing was the tasting of different Coca-Cola products from various countries. I easily spent a half hour in this section of the museum. The gift shop had plenty of different items to browse through. If visiting Atlanta, I highly recommend seeing the world of Coca-Cola.",a year ago,2023-02-14 16:49:02.874861,5.0,Rosita C,0,0,https://www.google.com/maps/contrib/110995622809257221720/reviews?hl=en-US
ChdDSUhNMG9nS0VJQ0FnSURCMDg2al9BRRAB,"Very recommended place to come!  Everything is great, the venue is not big, but each one is exquisite.  For history and its legends, this is definitely a place worth exploring!  There is also an amazing tasting center where you can taste a lot of different novelty flavors of coke, it's amazing!",2 weeks ago,2023-02-14 16:49:02.883017,5.0,Ning Hao,0,0,https://www.google.com/maps/contrib/108741138126691004966/reviews?hl=en-US
ChdDSUhNMG9nS0VJQ0FnSURlcUtHT3VnRRAB,"Here you can see the history of Coca-Cola, rare items and event shows.  It is very spacious and can be enjoyed for a long time.  Especially the Halloween show during Halloween was good.🎃 …",4 months ago,2023-02-14 16:49:02.884629,5.0,R1 Yoshi,0,0,https://www.google.com/maps/contrib/108618466144170389949/reviews?hl=en-US
ChZDSUhNMG9nS0VJQ0FnSURleWVIUFFREAE,"$21 to watch some heart felt presentation that’s totally not staged to any degree by Coca-Cola. The museum part is interesting, but the best part of this place is that testing room. Groups tend to crowd around each station (and there’s 3 per station), so expect to stand there awkwardly waiting for them as they block the whole thing.  There are lots of flavors from different countries and at corner but just has current coke products. If you’ve been to EPCOT in Disney World, you’ll see many familiar products.  Gift shop is cute as always, but to justify spending $21 to drink some weird cokes and then to spend more money in the bookstore is kinda hard, especially since you have to listen to actors and a presentation for the first 20 minutes (can’t skip).  Wouldn’t recommend and I do wish that people could just access the gift shop without going through the whole thing (guard outside the exit of the shop were directing people to the front).",4 months ago,2023-02-14 16:49:11.150419,3.0,Kim Marsh,0,0,https://www.google.com/maps/contrib/103465479227314834975/reviews?hl=en-US
ChdDSUhNMG9nS0VJQ0FnSURtcXZxNGtnRRAB,"The 3D theater, all the artifacts, the smell room, and of course the taste room at the end all made for an enjoyable 4 hours. My 4 your old enjoyed every part and especially loved sipping various drinks from around the world. It was well worth the time and price.",a year ago,2023-02-14 16:49:11.152059,5.0,Emilee Jacoby,0,0,https://www.google.com/maps/contrib/112547587165409783180/reviews?hl=en-US
ChdDSUhNMG9nS0VJQ0FnSURlN2NETWtnRRAB,Took the family to the World of Coke. Great visit and it was really cool seeing the history and how bottling works. Coke is a massive marketing company that sells beverages on the side. The first two exhibits seemed like we were rushed through. Overall it was a good experience. If you are in Atlanta stop in and check it out.,3 months ago,2023-02-14 16:49:11.153560,4.0,Jeffrey Butterfield,0,0,https://www.google.com/maps/contrib/104530334671641159823/reviews?hl=en-US
ChdDSUhNMG9nS0VJQ0FnSUNobkpxLTVBRRAB,"I went the first time like 7 years ago. Before covid this place was great, but I guess Covid took a lot from here too. But now everything “looks like” back to normal: no mask required , lots and lots of ppl all around you, means… this place is 100% back, so… why they can’t offer the same thing you were offering from before covid? 🤔  First, tickets still fair for a museum, adults:$19. Kids: $15, seniors: $17.  They used to have open coke bar before you enter the first attraction of the museum, Now they don’t. The 3D movie used to be 4D! (Was really, really cool) sadly they have to stop it because of a faulty seat malfunctioning several years ago. So no more moving chairs, sprinkling waters, snow falling, and tingling in your legs😞. Part of the museum was not showing anything at all(bottling part).  And they used to give you a 8onz glass bottle of coke for souvenir, (because of covid) they said. No more of those either. But… -you can buy one in the gift shop…they said🤣  Now… if is your first time going this place still cool to see it, tasting all over the world cokes and get ready to get your kids hyped 😅.",6 days ago,2023-02-14 16:49:11.154925,3.0,GNgFunwKids,0,0,https://www.google.com/maps/contrib/104421820723303729659/reviews?hl=en-US
ChZDSUhNMG9nS0VJQ0FnSUQtak51WlNnEAE,"What an amazing weekend trip to Atlanta with my girls for a surprise girls weekend.   My 10&11 year old and I spent hours at Coca Cola world enjoying the history, interactives and tasting room.  The price for the experiences were well worth it. Excellent chance to learn history about our favorite beverage. We will go back again!",2 months ago,2023-02-14 16:49:11.170249,5.0,Holly Ann Simpson,0,0,https://www.google.com/maps/contrib/112939487761781331070/reviews?hl=en-US
ChdDSUhNMG9nS0VJQ0FnSUNldTVybzlnRRAB,It was a fun experience learning the history of Coca Cola. The worldwide branding. The smelling and tasting rooms were our favorites.  The Olympic torches were cool and pics with the polar bear mascot,4 months ago,2023-02-14 16:49:11.171568,5.0,Jolynn Douglas,0,0,https://www.google.com/maps/contrib/102839146653573905343/reviews?hl=en-US
ChdDSUhNMG9nS0VJQ0FnSUQtM09xYzFnRRAB,"Surely worth a visit, The thicket is 20$ for adults,  less for kids and seniors, but there is also tax to add a bit more. Inside is beautiful and well organized. There are a few staff members who can help if you need anything. There is a sip/test area that is very enjoyable,  especially for kids. Tons of different Coca-Cola products from everywhere are available to taste. The end is a soviniour store and shop, of course overpriced,  but plenty of choices are there to shop. You need to park inside one of the nearby parking garages, not that much far, with less than 20$ for almost half a day. There is another parking area close by, not part of the facility,  a bit farther across the street,  but much cheaper, though.",2 months ago,2023-02-14 16:49:11.172843,4.0,Ali A,0,0,https://www.google.com/maps/contrib/106639557296200282011/reviews?hl=en-US
ChZDSUhNMG9nS0VJQ0FnSUNCX1lyQ2JnEAE,"A magnificent place. A lot to see and learn about the history of coca cola. Really loved it. At the end, you get to try as much coca cola as you want. So, it was like an all you can drink coca cola buffet.",a month ago,2023-02-14 16:49:11.183399,5.0,Shafiqul Islam Shadesh,0,0,https://www.google.com/maps/contrib/117489062666011088186/reviews?hl=en-US
ChZDSUhNMG9nS0VJQ0FnSUMteUktUUVBEAE,This was my second time visiting the World of Coca-cola! It is a fun activity to do with plenty of history and memorabilia to view. The tasting area is fun and you get to try more soda than you'd ever wish to drink. I'd totally recommend pairing up going here and the aquarium in the same day!,3 months ago,2023-02-14 16:49:11.184851,4.0,Cory Smith,0,0,https://www.google.com/maps/contrib/105187907319208493294/reviews?hl=en-US
ChdDSUhNMG9nS0VJQ0FnSUQtajVfMXlRRRAB,Best place to taste coco cola brands all over the world. You should really go after having pizza at aquarium and enjoy different cola here.. amazing experience. Weekdays not crowded. Nice place . Typical 2 hrs,2 months ago,2023-02-14 16:49:11.186199,5.0,Arjun rao,0,0,https://www.google.com/maps/contrib/100474246543284085260/reviews?hl=en-US
ChZDSUhNMG9nS0VJQ0FnSUMtcThDcEpnEAE,"Choose the flat fee parking next to the World of Coke. The “quad” between the World of Coke and the Aquariums is lovely, the WoC has three shows that you must stand/sit through before self-touring the exhibitions, but the performers are excellent and the shows do not take too long. Plenty of opportunities for photos, if you have young kids their main focus will be the taste section and gift shop at the very end of the tour. The exhibitions are a lot of fun, but more appreciated by those who can read. If your kids cannot follow a regular museum tour, they may not get 100% from WoC.",3 months ago,2023-02-14 16:49:19.502315,4.0,anderacpharmd,0,0,https://www.google.com/maps/contrib/115166333718735719189/reviews?hl=en-US
ChdDSUhNMG9nS0VJQ0FnSUNCc2FmNmhRRRAB,"The place was way overcrowded! Restrooms were disgusting, floor at the testing area was sticky and the 3D show is the old school kind that hurts your eyes. The stuff where annoying, it seems like due to poor training they where doing their own thing which was mostly disrespectful to the visitors. I think that this is not what the author intended. Parking is $17 flat fee. The biggest plus is that they have EV charging station.",a month ago,2023-02-14 16:49:19.503912,2.0,Amnon Nachshon,0,0,https://www.google.com/maps/contrib/117758035037681772936/reviews?hl=en-US
ChZDSUhNMG9nS0VJQ0FnSUMtdk1mZ2NnEAE,If you like coke this is the place to learn everything about it! Many exhibits and things to do. We’ll worth the price. I would get my tickets ahead online. When I left the line to buy tickets was pretty long on a Saturday midday. The tasting room was my fav!,3 months ago,2023-02-14 16:49:19.505091,5.0,Willie Ruiz,0,0,https://www.google.com/maps/contrib/117325691120927424905/reviews?hl=en-US
ChdDSUhNMG9nS0VJQ0FnSUQ2NDdMcTFRRRAB,"Coca-Cola museum... That's exactly what I expected, and it was so fun even though there is no new surprising stuff. It's just sugar water but you will realize it could be more than that. You can taste a lot of beverages there but the activity is going to be an activity that makes you recognize how the original Coca-Cola is special. That's my 5 cents!",a year ago,2023-02-14 16:49:19.506252,5.0,Nali Yan,0,0,https://www.google.com/maps/contrib/114218718670047260780/reviews?hl=en-US
ChdDSUhNMG9nS0VJQ0FnSURXaE12Q2lnRRAB,"This place was neat. A lot of coca cola artifacts from back in the day. Cool designs of packaging and you could see the line when it's produced. Not sure if it's real or just a demo for visitors. In the end you got to taste different come products from around the world (including tea, fanta, other products). It was unlimited. Gift shop was really cute too but of course pricey. It's nice if you combine your visit with aquarium and just park in the georgia aquarium garage. Also the Olympic park and the college football hall of fame (we didn't go). If you want. Stop by the yard milkshake bar. Not far of a walk while you're parked there. Otherwise parking would be a nightmare.",10 months ago,2023-02-14 16:49:19.507444,5.0,Jennifer Schwieterman,0,0,https://www.google.com/maps/contrib/113802757768876280934/reviews?hl=en-US
ChZDSUhNMG9nS0VJQ0FnSURHdjV5dVFnEAE,"Tickets are about 19.00 I walked right up to the ticketing window. Nice holiday theme. Totally worth it,  very informative and the tasting at the end is really good. They have a new smell exhibit that I enjoyed alot.",a year ago,2023-02-14 16:49:19.508591,4.0,shonta yeshua,0,0,https://www.google.com/maps/contrib/117738538711340773625/reviews?hl=en-US
ChZDSUhNMG9nS0VJQ0FnSUMtLUtIRVRREAE,It’s kinda fun if you are coco cola fan. Lot of good location for photos and you can get yo experience more than 100 different flavors,3 months ago,2023-02-14 16:49:19.509789,5.0,shrikumar hegde,0,0,https://www.google.com/maps/contrib/118272942288138949409/reviews?hl=en-US
ChZDSUhNMG9nS0VJQ0FnSUQtcy1TS0FREAE,"It's an amusing attraction and fun to see all the artifacts. The tasting room is like Epcot, where you can try lots of different flavors.",2 months ago,2023-02-14 16:49:19.511083,4.0,Chase Fullerton,0,0,https://www.google.com/maps/contrib/110580011600793360884/reviews?hl=en-US
ChZDSUhNMG9nS0VJQ0FnSUNXbEltcFl3EAE,One of big famous world company. All coca cola history and items see. Also move was good family happy with coca cola good memories. All family recommend.,11 months ago,2023-02-14 16:49:19.512282,3.0,Daniel Park,0,0,https://www.google.com/maps/contrib/109886607054745926266/reviews?hl=en-US
ChdDSUhNMG9nS0VJQ0FnSURHNGF5endBRRAB,"I have visited this place twice. Amazing fun experience with knowledge of history of Cola. As a pharmacist I was always intrigued by its inception. Polar bear pictures, scent museum, tasting room of all colas from world and 3D theater are highly recommended.",a year ago,2023-02-14 16:49:19.514079,4.0,Prajakta Masurkar,0,0,https://www.google.com/maps/contrib/113895484389460211097/reviews?hl=en-US
ChdDSUhNMG9nS0VJQ0FnSUNXOG95TXBnRRAB,"Pretty cool if u are a Coca Cola fan. The best part of the visit was the tasting station,  you get to taste all the Coca-Cola products throughout the world.",11 months ago,2023-02-14 16:49:28.135434,4.0,Linda Chupco,0,0,https://www.google.com/maps/contrib/106600121356413984465/reviews?hl=en-US
ChRDSUhNMG9nS0VJQ0FnSURlOVBGSRAB,"Enjoyed visiting world of coca cola, main attraction at this place os tasting different brands of coke in the world, you get to drink differet coke flavours . Overall good experience.",4 months ago,2023-02-14 16:49:28.136728,4.0,Saim Jawad Laliwala,0,0,https://www.google.com/maps/contrib/103903785568985352248/reviews?hl=en-US
ChZDSUhNMG9nS0VJQ0FnSUNlbXR5ZUJnEAE,It was awesome. I had no idea the impact Coca-Cola has had in the world. It was amazing to see the old advertiment and packaging. There is a whole history in the museum. Even if you don’t drink it (I don’t) I recommend visiting the museum.  There is discounts for tickets so be sure to check if you qualify for any of them before purchasing. If you are visiting during busy Atlanta days I recommend buying the tickets ahead of time.,5 months ago,2023-02-14 16:49:28.137948,5.0,Faby,0,0,https://www.google.com/maps/contrib/116104332682372835599/reviews?hl=en-US
ChdDSUhNMG9nS0VJQ0FnSUMtallyWGdBRRAB,"We had so much fun here at world of Coca-Cola. I couldn’t believe we were in there almost 3 hours, time went by flying but because we were enjoying our time. There’s so much to see and experience. I highly recommend this unique experience.",3 months ago,2023-02-14 16:49:28.139324,5.0,Neira Garcia,0,0,https://www.google.com/maps/contrib/111935862952251728150/reviews?hl=en-US
